{
  "notebook_type": "artificial_lab_notebook",
  "version": "3.0",
  "run_metadata": {
    "num_agents": 20,
    "num_epochs": 4,
    "active_pathogens": [
      "norwalk_gi",
      "sars_cov2_resp",
      "influenza_a"
    ],
    "zones": [
      "Bridge",
      "MedBay",
      "Mess_Hall",
      "Engine_Room",
      "Galley",
      "Berthing",
      "HD_MAIN_M",
      "HD_MAIN_F",
      "HD_UPPER_M"
    ],
    "trigger_timeline": [],
    "logging_fidelity": "HIGH_FIDELITY"
  },
  "total_records": 76,
  "fidelity_tier_definitions": {
    "HIGH_FIDELITY": "Raw Synthetic Instrument \u2014 cycle-by-cycle curves, raw fluorescence, pre-norm reads",
    "MID_FIDELITY": "Certified Clinical \u2014 CAP-style reports, DETECTED/NOT DETECTED, QC flags",
    "LOW_FIDELITY": "Command/Strategic \u2014 GREEN/AMBER/RED stoplight indicators"
  },
  "records": [
    {
      "sample_id": "CLN-000-BRIDGE-AIR_-565a0df6",
      "timestamp_epoch": 0,
      "collection_point_type": "continuous_air_sampler",
      "collection_zone": "Bridge",
      "assay_type": "aerosol_pcr",
      "fidelity_tier": "HIGH_FIDELITY",
      "binary_result": "NOT DETECTED",
      "inferred_anomaly_score": 0.0,
      "ct_value": null,
      "captured_mass": 0.0,
      "concentration_per_m3": 0.0,
      "sampled_volume_m3": 4.0,
      "qc_status": "QC_NOT_RUN",
      "cross_contamination_carryover": 0.0,
      "raw_amplification_curve": [
        134.4,
        161.3,
        164.1,
        120.7,
        130.5,
        151.9,
        145.3,
        149.7,
        137.2,
        163.2,
        161.7,
        151.0,
        166.9,
        157.0,
        137.1,
        155.5,
        135.6,
        163.2,
        149.3,
        147.2,
        139.8,
        168.3,
        147.7,
        143.6,
        144.7,
        158.0,
        155.5,
        156.2,
        156.5,
        182.1,
        143.9,
        142.3,
        137.8,
        159.2,
        166.9,
        148.3,
        137.4,
        137.6,
        159.8,
        161.1
      ],
      "background_fluorescence": 160.9
    },
    {
      "sample_id": "CLN-000-MEDBAY-AIR_-b9cd0542",
      "timestamp_epoch": 0,
      "collection_point_type": "continuous_air_sampler",
      "collection_zone": "MedBay",
      "assay_type": "aerosol_pcr",
      "fidelity_tier": "HIGH_FIDELITY",
      "binary_result": "NOT DETECTED",
      "inferred_anomaly_score": 0.0,
      "ct_value": null,
      "captured_mass": 0.0,
      "concentration_per_m3": 0.0,
      "sampled_volume_m3": 2.25,
      "qc_status": "QC_NOT_RUN",
      "cross_contamination_carryover": 0.0,
      "raw_amplification_curve": [
        153.5,
        151.8,
        153.3,
        163.1,
        153.4,
        160.2,
        151.0,
        154.3,
        159.5,
        128.1,
        145.2,
        142.9,
        140.4,
        145.9,
        172.4,
        137.0,
        164.5,
        124.8,
        145.0,
        152.4,
        158.8,
        160.7,
        161.9,
        144.8,
        143.1,
        162.9,
        147.1,
        130.9,
        133.0,
        136.2,
        157.5,
        152.1,
        160.4,
        143.6,
        152.4,
        159.4,
        145.4,
        156.9,
        140.1,
        144.6
      ],
      "background_fluorescence": 142.4
    },
    {
      "sample_id": "CLN-000-MESS_H-AIR_-561ccd17",
      "timestamp_epoch": 0,
      "collection_point_type": "continuous_air_sampler",
      "collection_zone": "Mess_Hall",
      "assay_type": "aerosol_pcr",
      "fidelity_tier": "HIGH_FIDELITY",
      "binary_result": "NOT DETECTED",
      "inferred_anomaly_score": 0.0,
      "ct_value": null,
      "captured_mass": 0.0,
      "concentration_per_m3": 0.0,
      "sampled_volume_m3": 6.0,
      "qc_status": "QC_NOT_RUN",
      "cross_contamination_carryover": 0.0,
      "raw_amplification_curve": [
        157.3,
        143.0,
        150.2,
        157.2,
        156.7,
        160.0,
        148.5,
        143.7,
        148.8,
        124.7,
        128.3,
        130.2,
        135.0,
        156.0,
        136.4,
        144.3,
        169.5,
        144.7,
        161.1,
        136.0,
        146.9,
        135.7,
        144.9,
        162.6,
        124.1,
        156.5,
        153.6,
        141.1,
        128.3,
        151.1,
        142.1,
        153.5,
        150.3,
        174.0,
        146.4,
        134.6,
        152.7,
        153.3,
        170.4,
        162.5
      ],
      "background_fluorescence": 157.1
    },
    {
      "sample_id": "CLN-000-ENGINE-AIR_-033d6153",
      "timestamp_epoch": 0,
      "collection_point_type": "continuous_air_sampler",
      "collection_zone": "Engine_Room",
      "assay_type": "aerosol_pcr",
      "fidelity_tier": "HIGH_FIDELITY",
      "binary_result": "NOT DETECTED",
      "inferred_anomaly_score": 0.0,
      "ct_value": null,
      "captured_mass": 0.0,
      "concentration_per_m3": 0.0,
      "sampled_volume_m3": 10.0,
      "qc_status": "QC_NOT_RUN",
      "cross_contamination_carryover": 0.0,
      "raw_amplification_curve": [
        132.2,
        140.4,
        136.1,
        144.2,
        129.3,
        159.5,
        146.7,
        127.9,
        134.8,
        154.7,
        162.6,
        180.0,
        193.7,
        156.2,
        135.2,
        118.0,
        154.0,
        137.8,
        143.8,
        140.8,
        147.9,
        166.0,
        152.4,
        147.6,
        134.5,
        124.9,
        142.7,
        149.2,
        176.5,
        152.0,
        164.7,
        142.5,
        132.2,
        135.5,
        139.1,
        181.9,
        137.7,
        162.6,
        136.5,
        164.0
      ],
      "background_fluorescence": 157.7
    },
    {
      "sample_id": "CLN-000-GALLEY-AIR_-d851b63b",
      "timestamp_epoch": 0,
      "collection_point_type": "continuous_air_sampler",
      "collection_zone": "Galley",
      "assay_type": "aerosol_pcr",
      "fidelity_tier": "HIGH_FIDELITY",
      "binary_result": "NOT DETECTED",
      "inferred_anomaly_score": 0.0,
      "ct_value": null,
      "captured_mass": 0.0,
      "concentration_per_m3": 0.0,
      "sampled_volume_m3": 3.0,
      "qc_status": "QC_NOT_RUN",
      "cross_contamination_carryover": 0.0,
      "raw_amplification_curve": [
        149.4,
        140.2,
        156.7,
        143.2,
        131.6,
        130.8,
        152.6,
        173.7,
        152.4,
        148.2,
        154.3,
        169.6,
        153.3,
        143.8,
        166.6,
        156.4,
        173.0,
        152.7,
        131.6,
        129.5,
        174.8,
        175.9,
        147.3,
        144.3,
        171.9,
        133.4,
        136.6,
        159.6,
        144.1,
        149.9,
        147.5,
        155.1,
        171.1,
        151.4,
        159.7,
        119.2,
        149.3,
        137.4,
        131.7,
        136.8
      ],
      "background_fluorescence": 143.3
    },
    {
      "sample_id": "CLN-000-BERTHI-AIR_-f0bf9532",
      "timestamp_epoch": 0,
      "collection_point_type": "continuous_air_sampler",
      "collection_zone": "Berthing",
      "assay_type": "aerosol_pcr",
      "fidelity_tier": "HIGH_FIDELITY",
      "binary_result": "NOT DETECTED",
      "inferred_anomaly_score": 0.0,
      "ct_value": null,
      "captured_mass": 0.0,
      "concentration_per_m3": 0.0,
      "sampled_volume_m3": 7.5,
      "qc_status": "QC_PASS",
      "qc_measured_mass": 0.0017287,
      "cross_contamination_carryover": 0.0,
      "raw_amplification_curve": [
        130.1,
        150.5,
        142.7,
        145.1,
        165.0,
        158.1,
        170.1,
        147.7,
        139.6,
        146.6,
        153.6,
        152.6,
        133.7,
        151.4,
        153.4,
        187.8,
        178.2,
        137.2,
        145.7,
        128.0,
        141.1,
        154.7,
        168.1,
        139.1,
        140.2,
        117.8,
        147.6,
        134.1,
        142.1,
        136.8,
        148.6,
        123.6,
        128.0,
        181.9,
        130.7,
        133.5,
        177.6,
        193.6,
        132.4,
        144.5
      ],
      "background_fluorescence": 156.8
    },
    {
      "sample_id": "CLN-000-HD_MAI-AIR_-68edb864",
      "timestamp_epoch": 0,
      "collection_point_type": "continuous_air_sampler",
      "collection_zone": "HD_MAIN_M",
      "assay_type": "aerosol_pcr",
      "fidelity_tier": "HIGH_FIDELITY",
      "binary_result": "NOT DETECTED",
      "inferred_anomaly_score": 0.0,
      "ct_value": null,
      "captured_mass": 0.0,
      "concentration_per_m3": 0.0,
      "sampled_volume_m3": 0.93,
      "qc_status": "QC_NOT_RUN",
      "cross_contamination_carryover": 0.0,
      "raw_amplification_curve": [
        146.3,
        161.7,
        156.5,
        144.4,
        148.0,
        129.4,
        146.4,
        146.0,
        153.5,
        141.7,
        157.1,
        165.2,
        152.3,
        155.3,
        150.8,
        150.0,
        139.2,
        154.7,
        148.5,
        181.4,
        173.6,
        155.8,
        138.6,
        133.3,
        167.9,
        153.9,
        157.2,
        123.8,
        163.9,
        156.8,
        133.3,
        142.9,
        154.0,
        150.8,
        145.6,
        148.4,
        146.2,
        152.3,
        172.1,
        111.5
      ],
      "background_fluorescence": 145.3
    },
    {
      "sample_id": "CLN-000-HD_MAI-AIR_-88fd1f82",
      "timestamp_epoch": 0,
      "collection_point_type": "continuous_air_sampler",
      "collection_zone": "HD_MAIN_F",
      "assay_type": "aerosol_pcr",
      "fidelity_tier": "HIGH_FIDELITY",
      "binary_result": "NOT DETECTED",
      "inferred_anomaly_score": 0.0,
      "ct_value": null,
      "captured_mass": 0.0,
      "concentration_per_m3": 0.0,
      "sampled_volume_m3": 0.62,
      "qc_status": "QC_NOT_RUN",
      "cross_contamination_carryover": 0.0,
      "raw_amplification_curve": [
        154.4,
        144.4,